"MAN, Kam Wah",Greenfield International Nursery (Tung Chung),"Kindergarten Podium First Floor (Portion), Caribbean Bazaar, Caribbean Coast, 1 Kin Tung Road, Tung Chung, Lantau Island, Hong Kong.",21625538,21625528,NON-AIDED CHILD CARE CENTRE ATTACHED TO KINDERGARTEN,2-3,0,10278,6335,0,0,AM & PM Sessions,,0,2,38,CW/S/I
"MAN, Kam Wah",Greenville Kids' World International Nursrey,"Portion of Shop No. 108, Level One, La Cite Noble Shopping Arcade, No. 1 Ngan O Road, Tseung Kwan O, Kowloon.",22743355,22743611,NON-AIDED CHILD CARE CENTRE ATTACHED TO KINDERGARTEN,2-3,0,6670,5300,0,0,AM & PM Sessions,,0,19,80,WTS/SK
Guidepost Chai Wan Limited,Guidepost Montessori International Child Care Centre (Chai Wan),"Part of Shop Kindergarten, G/F, Harmony Garden, 9 Siu Sai Wan Road, Chai Wan, Hong Kong",28668260,34681913,NON-AIDED CHILD CARE CENTRE ATTACHED TO KINDERGARTEN,2-3,0,0,8200,0,0,AM & PM Sessions,,0,0,56,E/W
Guidepost Kennedy Town Limited,Guidepost Montessori International Child Care Centre (Kennedy Town),"Portion of Shop C on G/F, 1/F & 2/F, Pak Hoo Mansion, 554-560 Queen's Road West, Sai Wan, Hong Kong (Portion)",36191136,34681913,NON-AIDED CHILD CARE CENTRE ATTACHED TO KINDERGARTEN,2-3,0,0,0,9000,7600,AM & PM Sessions,,0,0,56,CW/S/I
CONCEPT POWER LIMITED,HARTS PLAYSCHOOL,"G/F and whole 1/F, High Park Grand, 68 Boundary Street, Kowloon",23382878,23376322,NON-AIDED CHILD CARE CENTRE ATTACHED TO KINDERGARTEN,2-3,0,0,7560,0,0,AM & PM Sessions,,0,0,65,KC/YTM
Hazelwood International Education Limited,Pui Kiu International Nursery,"Portion of Level 1, Phase 2, Belair Gardens, Shopping Arcade, 52 Tai Chung Kiu Road, Shatin, New Territories",35909990,36166000,NON-AIDED CHILD CARE CENTRE ATTACHED TO KINDERGARTEN,2-3,0,0,5900,0,0,AM & PM Sessions,,0,0,60,ST
"BENNETT, Kit Ling Cannie",Highgate House Nursery School,"Portion of Shop No.6, 2/F, Block B, Dairy Farm Shopping Centre, 100-104 Peak Road, Hong Kong",28496336,28496332,NON-AIDED CHILD CARE CENTRE ATTACHED TO KINDERGARTEN,2-3,0,0,14000,0,0,AM & PM Sessions,,0,0,50,CW/S/I
Sik Sik Yuen,Ho Tak Child Care Centre (Sponsored by Sik Sik Yuen),"G/F (Portion), Chung Yuen House, Chuk Yuen North Estate, Wong Tai Sin, Kowloon.",23500721,23227478,NON-AIDED CHILD CARE CENTRE ATTACHED TO KINDERGARTEN,2-3,0,4430,2100,0,0,AM & PM Sessions,,0,12,12,WTS/SK
Sheng Kung Hui Holy Trinity Church,Holy Trinity Centre Day Nursery,"G/F, Rooms 101-104 of 1/F, and Room 202-203 of 2/F, Holy Trinity Bradbury Centre, 139 Ma Tau Chung Road, Kowloon City, Kowloon",27154265,27157431,NON-AIDED CHILD CARE CENTRE ATTACHED TO KINDERGARTEN,2-3,0,6949,0,0,0,NIL,,0,156,0,KC/YTM
The Church of Christ in China Tuen Mun Church Ltd.,"Hoh Fuk Tong Nursery School, Tuen Mun Church, The Church of Christ in China, Hong Kong Council","Unit 111-118, Tip Mo House, Butterfly Estate, Tuen Mun, N.T. (portion)",24675078,24656499,NON-AIDED CHILD CARE CENTRE ATTACHED TO KINDERGARTEN,2-3,0,0,0,0,3100,PM Session,,0,0,56,TM
Heung Hoi Ching Lok Lin Association,HHCKLA Buddhist Wai Kwong Ka Fuk Nursery School,"Part of Shop KG01, G/F, Ka Yeung House, Ka Shing Court, Fanling, New Territories",26832227,26832023,NON-AIDED CHILD CARE CENTRE ATTACHED TO KINDERGARTEN,2-3,0,0,3310,0,0,AM & PM Sessions,,0,0,90,TP/N
"CHIU TSANG, Hok Wan",HONG KONG (ASCOT) PLAYSCHOOL,"No. 1, G/F, Tsun King Road, Royal Ascot, Fo Tan, Shatin, New Territories",23332939,26349831,NON-AIDED CHILD CARE CENTRE ATTACHED TO KINDERGARTEN,2-3,0,0,6320,0,0,AM & PM Sessions,,0,0,63,ST
5-S Quality Education Institution Limited,Hong Kong 5-S International Child Care Centre,"No. 8-10, Level 2, Shopping Centre, Belair Monte, 3 Ma Sik Road, Fanling, New Territories",27210081,27210086,NON-AIDED CHILD CARE CENTRE ATTACHED TO KINDERGARTEN,2-3,0,5897,2673,0,0,AM & PM Sessions,,0,89,60,TP/N
Hong Kong Bethel Church Limited,Hong Kong Bethel Church Gideon Nursery,"Part of G/F, Lok Tung House, Lok Fu Estate, Kowloon.",23362553,23362567,NON-AIDED CHILD CARE CENTRE ATTACHED TO KINDERGARTEN,2-3,0,4260,2170,0,0,AM & PM Sessions,,0,14,5,WTS/SK
The Council of Ling Liang World-wide Evangelistic Mission Hong Kong Ling Liang Church,Hong Kong Ling Liang Church Sau Tak Nursery,"Shop 6-8, 1/F, West Kowloon Place, One West Kowloon, 873 Lai Chi Kok Road, Kowloon",35202238,35202237,NON-AIDED CHILD CARE CENTRE ATTACHED TO KINDERGARTEN,2-3,0,0,4463,0,0,AM & PM Sessions,,0,0,138,SSP
"NG, Lai Keung",Hong Kong Man Sang International Nursery,"2/F (Portion), Foo Yet Kai Building, 52-60 Java Road, North Point, Hong Kong",25786763,25715254,NON-AIDED CHILD CARE CENTRE ATTACHED TO KINDERGARTEN,2-3,0,8875,5200,0,0,AM & PM Sessions,,0,40,50,E/W
World Eagle International Limited,Hong Kong Man Sang International Nursery (Western District),"Portion of Shop A, G/F & Portion of 1/F, Nice Garden, 513-519 Queen's Road West, Hong Kong",23363232,23363526,NON-AIDED CHILD CARE CENTRE ATTACHED TO KINDERGARTEN,2-3,0,8785,5684,0,0,AM & PM Sessions,,0,28,34,CW/S/I
Nobel Education Organisation Limited,Hong Kong Nobel Playschool,"Shop B2 on G/F, 1/F (Portion), Nin Fung Building, 65-65D Waterloo Road, Kowloon",23387899,23387922,NON-AIDED CHILD CARE CENTRE ATTACHED TO KINDERGARTEN,2-3,0,0,6580,0,0,AM & PM Sessions,,0,0,84,KC/YTM
The Hong Kong Taoist Association,Hong Kong Taoist Association Yuen Yuen Child Care Centre,"Unit No. 33-40 & 41-54, G/F (Portion), Shek To House, Shek Wai Kok Estate, Tsuen Wan, New Territories",24166086,27020789,NON-AIDED CHILD CARE CENTRE ATTACHED TO KINDERGARTEN,2-3,0,0,3200,0,0,AM & PM Sessions,,0,0,57,TW/KwT
The Hong Kong Taoist Association,Hong Kong Taoist Association Yuen Yuen Child Care Centre (Fu Shin Estate),"Wing A and B, G/F, Shin Mei House, Fu Shin Estate, Tai Po, New Territories (Portion)",26614583,26613118,NON-AIDED CHILD CARE CENTRE ATTACHED TO KINDERGARTEN,2-3,0,0,2565,0,0,AM & PM Sessions,,0,0,24,TP/N
The Hong Kong Taoist Association,Hong Kong Taoist Association Yuen Yuen Child Care Centre (Tung Tau Estate),"No. 9-14, G/F, Yan Tung House, Tung Tau Estate, Kowloon (Portion)",27183637,23837607,NON-AIDED CHILD CARE CENTRE ATTACHED TO KINDERGARTEN,2-3,0,0,2698,0,0,AM & PM Sessions,,0,0,43,WTS/SK
Lam Tin Estate Kai Fong Welfare Association Limited,Hong Ying Child Care Centre,"G/F (Portion), Hong Ying Court, Tak Tin Estate, Lam Tin, Kowloon.",27723243,27751476,NON-AIDED CHILD CARE CENTRE ATTACHED TO KINDERGARTEN,2-3,0,0,2476,0,0,AM & PM Sessions,,0,0,24,KT
Hop Yat Church of the Church of Christ in China,Hop Yat Church Chan Pak Wang Memorial Day Nursery,"Portion of 1/F & 2/F, Landing Floor between 3-4/F, 48 Cloud View Road, North Point, Hong Kong",25785759,25715887,NON-AIDED CHILD CARE CENTRE ATTACHED TO KINDERGARTEN,2-3,0,5236,2970,0,0,AM & PM Sessions,,0,28,70,E/W
Hop Yat Church of the Church of Christ in China,Hop Yat Church Shin Ka Chuen Memorial Day Nursery,"1/F, 26 On Shing Street, Ma On Shan, Shatin, New Territories",26441584,29794952,NON-AIDED CHILD CARE CENTRE ATTACHED TO KINDERGARTEN,2-3,0,0,2765,0,0,AM & PM Sessions,,0,70,58,ST
Ms LAU Lai-ming Kelly,Island Children's Montessori Child Care Centre,"Unit C, Lower G/F & Unit B, Upper G/F, Dragon View Garden, No. 16 Tin Hau Temple Road, Hong Kong",34279100,34279101,NON-AIDED CHILD CARE CENTRE ATTACHED TO KINDERGARTEN,2-3,0,0,6150,0,0,AM & PM Sessions,,0,0,24,E/W
Ms LAU Lai Ming Kelly,Island Montessori International Nursery,"Commercial Unit or Portion on G/F, Bedford Garden, Nos. 151-173 Tin Hau Temple Road, Hong Kong",34279100,34279101,NON-AIDED CHILD CARE CENTRE ATTACHED TO KINDERGARTEN,2-3,0,0,0,6560,0,AM Session,,0,0,40,E/W
Sapientia Foundation,Italian International Nursery,"Portion of Podium Level 1, Block 4, Phase 1, South Horizons, Ap Lei Chau, Hong Kong",26623066,26623666,NON-AIDED CHILD CARE CENTRE ATTACHED TO KINDERGARTEN,2-3,0,11233,6830,0,0,AM & PM Sessions,,0,12,56,CW/S/I
Sunway Association Limited,James Day Nursery (Shun Ning Road),"Portion of G/F, Block 7, Cronin Garden, 16 Shun Ning Road, Sham Shui Po, Kowloon",23868877,23870789,NON-AIDED CHILD CARE CENTRE ATTACHED TO KINDERGARTEN,2-3,0,5762,0,3661,0,AM Session,,0,20,27,SSP
DONALD So Han,Jing Jing International Nursery,"Shop Nos 47-54, G/F, Chi Lok Fa Yuen, 18 Tsing Hoi Circuit, Tuen Mun, New Territories",24045266,24045267,NON-AIDED CHILD CARE CENTRE ATTACHED TO KINDERGARTEN,2-3,0,10531,7179,0,0,AM & PM Sessions,,0,4,18,TM
JING JING EDUCATION INSTITUTE LIMITED,Jing Jing Nursery (Shun Lee Branch),"Portion of Shop No. 15A, Commercial Premises, Podium Level 2 of Shun Lee Disciplined Services Quarter, 32 Lee On Road, Kowloon",34094481,34094491,NON-AIDED CHILD CARE CENTRE ATTACHED TO KINDERGARTEN,2-3,0,0,3848,0,0,AM & PM Sessions,,0,0,20,KT
Jing Jing Education Institute Limited,Jing Jing International Preschool (Common Bond Branch),"Upper G/F, Shop 14-20, 23, Common Bond Shopping Arcade, 7 Tsing Chui Path, Tuen Mun, N.T.",24574666,24571572,NON-AIDED CHILD CARE CENTRE ATTACHED TO KINDERGARTEN,2-3,0,7115,3647,0,0,AM & PM Sessions,,0,14,42,TM
"MA, Sum-yee Shirley",Joyful World International Nursery,"G/F, Block 11-12 Tsuen King Garden, 76-84 Tsuen King Circuit, Tsuen Wan, N.T.",24928555,24928566,NON-AIDED CHILD CARE CENTRE ATTACHED TO KINDERGARTEN,2-3,0,0,5980,0,0,AM & PM Sessions,,0,0,90,TW/KwT
Ms Ma Sum Yee Shirley,Joyful World International Nursery (Belvedere),"Shop 101-118, 1/F & Portion on G/F, Belvedere Square, Belvedere Garden Phase 2, 620 Castle Peak Road Tsuen Wan, Tsuen Wan, N.T.",28060199,28060192,NON-AIDED CHILD CARE CENTRE ATTACHED TO KINDERGARTEN,2-3,0,0,6280,0,0,AM & PM Sessions,,0,0,126,TW/KwT
"Ms Ma Sum Yee, Shirley",Joyful World International Nursery (Sha Tin),"Shop 701, 7/F, Jubilee Square, 2-18 Lok King Street, Fo Tan, Shatin, New Territories",24939009,24939011,NON-AIDED CHILD CARE CENTRE ATTACHED TO KINDERGARTEN,2-3,0,0,6380,0,0,AM & PM Sessions,,0,0,112,ST
"Ma, Sum Yee Shirley",Joyful World International Nursery (Tuen Mun),"Portion of Shop 2-3 on 2nd Floor of Commercial Complex, Tai Hing Gardens Phase II, 10A Ho Hing Circuit, Tuen Mun, New Territories",24928772,24928773,NON-AIDED CHILD CARE CENTRE ATTACHED TO KINDERGARTEN,2-3,0,0,6680,0,0,AM & PM Sessions,,0,0,56,TM
"MA, Sum Yee Shirley",Joyful World International Nursery (Yuen Long),"1/F, Lin Fat Building, 2 Fung Kwan Street, Yuen Long, New Territories",24939997,24939987,NON-AIDED CHILD CARE CENTRE ATTACHED TO KINDERGARTEN,2-3,0,0,6180,0,0,AM & PM Sessions,,0,0,56,YL
Fine Ascent Corporation Limited,Joystem International Nursery,"Portion of Kindergarten, Level 3, Package 7, LOHAS Park, 1 LOHAS Park Road, Tseung Kwan O, New Territories",26311299,26311850,NON-AIDED CHILD CARE CENTRE ATTACHED TO KINDERGARTEN,2-3,0,0,7600,0,0,AM & PM Sessions,,0,0,28,WTS/SK
Kingsland Kindergarten (Fu Ning Garden School) Limited,Junk Bay Kingsland Nursery,"Portion of G/F, Kwan Ming House, Yuk Ming Court, Tseung Kwan O, Sai Kung, New Territories",27052211,27052275,NON-AIDED CHILD CARE CENTRE ATTACHED TO KINDERGARTEN,2-3,0,5175,3668,0,0,AM & PM Sessions,,0,7,46,WTS/SK
Karlam Professional Education Limited,Karlam Nursery (Yue Fung Mansion),"1/F, 59 On Ning Road, Yuen Long, New Territories",24425966,24433217,NON-AIDED CHILD CARE CENTRE ATTACHED TO KINDERGARTEN,2-3,0,5732,3031,0,0,AM & PM Sessions,,0,124,62,YL
"CHAN YEN, Dai Li, Helena",Keen Mind Nursery,"G/F (Portion), 13 Cumberland Road, Kowloon Tong, Kowloon.",23380832,23380079,NON-AIDED CHILD CARE CENTRE ATTACHED TO KINDERGARTEN,2-3,0,0,5719,0,0,AM & PM Sessions,,0,0,76,KC/YTM
CHAN Wilbert,Kendall Nursery School,"Part of G/F, Residence 228, 228 Fuk Wing Street, Cheung Sha Wan, Kowloon",23288223,23288710,NON-AIDED CHILD CARE CENTRE ATTACHED TO KINDERGARTEN,2-3,0,0,0,6200,5800,AM & PM Sessions,,0,0,18,SSP
CHANG Albert Ho-yin,Kiangsu & Chekiang Nursery,"G/F, 30 Ching Wah Street, North Point, Hong Kong",25704173,25129095,NON-AIDED CHILD CARE CENTRE ATTACHED TO KINDERGARTEN,2-3,0,0,4830,0,0,AM & PM Sessions,,0,0,97,E/W
Concord Fair Enterprises Limited,Kornhill Victoria Nursery,"Portion of 2/F, 18 Hong On Street, Kornhill, Quarry Bay, Hong Kong",28851888,25609353,NON-AIDED CHILD CARE CENTRE ATTACHED TO KINDERGARTEN,0-3,0,0,9890,0,0,AM & PM Sessions,,0,0,39,E/W
Kowloon City Baptist Church,Kowloon City Baptist Church Hay Nien Child Care Centre,"Portion of G/F, Banyan House, Kwong Yuen Estate, Shatin, New Territories",26487073,26483696,NON-AIDED CHILD CARE CENTRE ATTACHED TO KINDERGARTEN,2-3,0,0,3325,0,0,AM & PM Sessions,,0,0,22,ST
Debra Yuk-man PEI,Kowloon Funful Children's Corner,"20 Durham Road, Flat 1 & 2, 1/F & 2/F, Kowloon Tong, Kowloon",23370686,23386125,NON-AIDED CHILD CARE CENTRE ATTACHED TO KINDERGARTEN,2-3,0,9421,6875,0,0,AM & PM Sessions,,0,100,376,KC/YTM
Kowloon Ling Liang Church,Kowloon Ling Liang Church Day Nursery,"4th & 5th floor, Kowloon Ling Liang Church, 1 Grampian Road, Kowloon City, Kowloon",23372575,23382859,NON-AIDED CHILD CARE CENTRE ATTACHED TO KINDERGARTEN,2-3,0,7040,0,0,0,NIL,,0,242,0,KC/YTM
The Council of Ling Liang World-wide Evangelistic Mission Hong Kong Ling Liang Church,Lam Tin Ling Liang Nursery,"Part of G/F, Site A, No. 12 Laguna Street, Laguna City, Kwun Tong, Kowloon",28056699,27720868,NON-AIDED CHILD CARE CENTRE ATTACHED TO KINDERGARTEN,2-3,0,0,5420,0,0,AM & PM Sessions,,0,0,101,KT
Pre-School Habitat Co. Ltd.,Learning Habitat (Bilingual) Nursery,"Part of Level 1, Commercial Building of Phase 1, Villa Esplanada, 8 Nga Ying Chau Street, Tsing Yi, New Territories",25015500,25015868,NON-AIDED CHILD CARE CENTRE ATTACHED TO KINDERGARTEN,2-3,0,0,7200,0,0,AM & PM Sessions,,0,0,28,TW/KwT
Pre-School Habitat (Laguna Verde) Co. Limited,Learning Habitat Bilingual Nursery (Chatham LV),"G06-G26, G/F, Chatham Place, 388 Chatham Road North, Hung Hom, Kowloon",23631500,23632010,NON-AIDED CHILD CARE CENTRE ATTACHED TO KINDERGARTEN,2-3,0,0,7200,0,0,AM & PM Sessions,,0,0,85,KC/YTM
Pre-School Habitat (Double Cove) Co. Limited,Learning Habitat Bilingual Nursery (Double Cove),"1/F, Phase 3, Double Cove, 8 Wu Kai Sha Road, Lok Wo Sha, Ma On Shan, Sha Tin, New Territories",25015850,25015432,NON-AIDED CHILD CARE CENTRE ATTACHED TO KINDERGARTEN,2-3,0,0,6700,0,0,AM & PM Sessions,,0,0,103,ST
Pre-School Habitat (Hampton Loft) Co. Limited,Learning Habitat Bilingual Nursery (Hampton Loft),"Part of Shop No. 2, 5/F, Hampton Loft, 11 Hoi Fan Road, Tai Kok Tsui, Kowloon.",25015105,27004663,NON-AIDED CHILD CARE CENTRE ATTACHED TO KINDERGARTEN,2-3,0,0,7200,0,0,AM & PM Sessions,,0,0,84,KC/YTM
Pre-School Habitat (Novum East) Co. Ltd,Learning Habitat Bilingual Nursery (Novum East),"1/F of the Commercial Development of Novum East, 856 King's Road, Hong Kong",25015108,23650533,NON-AIDED CHILD CARE CENTRE ATTACHED TO KINDERGARTEN,2-3,0,0,6900,0,0,AM & PM Sessions,,0,0,84,E/W
Pre-School Habitat (Olympic) Co. Limited,Learning Habitat Bilingual Nursery (Olympic),"Unit No. 1A, 5/F, Hampton Loft, 11 Hoi Fan Road, Tai Kok Tsui, Kowloon",25015560,29436722,NON-AIDED CHILD CARE CENTRE ATTACHED TO KINDERGARTEN,2-3,0,0,7200,0,0,AM & PM Sessions,,0,0,28,KC/YTM
Pre-School Habitat (Lohas Park) Co. Limited,Learning Habitat Bilingual Nursery (Papillons LP),"Shop Nos. 12, 15 & 16, G/F, Papillons Square, No. 21 Tong Chun Street, Tseung Kwan O, New Territories",23633005,23633305,NON-AIDED CHILD CARE CENTRE ATTACHED TO KINDERGARTEN,2-3,0,0,7200,0,0,AM & PM Sessions,,0,0,87,WTS/SK
Pre-School Habitat (The Sparkle) Co. Ltd,Learning Habitat Bilingual Nursery (The Sparkle),"1/F, Commercial Development, The Sparkle, 500 Tung Chau Street, Kowloon",25010136,23632433,NON-AIDED CHILD CARE CENTRE ATTACHED TO KINDERGARTEN,2-3,0,0,7200,0,0,AM & PM Sessions,,0,0,84,SSP
Hong Kong Kids Academy Limited,Les Petits Lascars International Nursery (Tseung Kwan O),"Portion of Shop G01, G/F., Capri, 33 Tong Yin Street, Tseung Kwan O, New Territories",25268666,25269098,NON-AIDED CHILD CARE CENTRE ATTACHED TO KINDERGARTEN,2-3,0,0,7250,0,0,AM & PM Sessions,,0,0,24,WTS/SK
Lingnan Education Organization Limited,Lingnan Day Nursery (Siu Sai Wan),"G/F of the Kindergarten Building of Cheerful Garden, 23 Siu Sai Wan Road, Hong Kong",28932322,28930168,NON-AIDED CHILD CARE CENTRE ATTACHED TO KINDERGARTEN,2-3,0,5885,3260,0,0,AM & PM Sessions,,0,50,77,E/W
Little Dalton Pre-school Limited,Little Dalton Nursery School (West Kowloon),"Unit B, G/F, Imperial Cullinan, 10 Hoi Fai Road, Tai Kok Tsui, Kowloon",36125760,36125766,NON-AIDED CHILD CARE CENTRE ATTACHED TO KINDERGARTEN,2-3,0,0,10200,0,0,AM & PM Sessions,,0,0,28,KC/YTM
Tak Yan Kindergarten Limited,Little Newton International Preschool,"1/F, Nam Kwong Building, 11A Tseng Choi Street, Tuen Mun, New Territories",39552228,35656528,NON-AIDED CHILD CARE CENTRE ATTACHED TO KINDERGARTEN,2-3,0,6035,3735,0,0,AM & PM Sessions,,0,14,42,TM
Lou Pichoun Limited,Lou Pichoun French Nursery,"Portion of Shop 1A, 1B & 2A, G/F, Commercial Accommodation, Alto Residences, 29 Tong Yin Street, Tseung Kwan O, New Territories, Hong Kong",28134277,28134377,NON-AIDED CHILD CARE CENTRE ATTACHED TO KINDERGARTEN,2-3,0,0,7950,0,0,AM & PM Sessions,,0,0,13,WTS/SK
"LUK, Kwan Che Ellen",Luk Yeung Child Care Centre,"Shop Unit UP1 (Portion), Luk Yeung Galleria, Luk Yeung Sun Chuen, Tsuen Wan, New Territories.",24998832,24993429,NON-AIDED CHILD CARE CENTRE ATTACHED TO KINDERGARTEN,2-3,0,0,5300,0,0,AM & PM Sessions,,0,0,76,TW/KwT
Elite Education Consulting and Service Company Limited,MAGART International Nursery (Fanling),"G/F, Block A & B, Fanling Centre, Phase I, 33 San Wan Road, Fanling, New Territories",26778109,26778802,NON-AIDED CHILD CARE CENTRE ATTACHED TO KINDERGARTEN,2-3,0,9010,6180,0,0,AM & PM Sessions,,0,40,44,TP/N
Kresbi HK Limited,Maple Bear Canadian International Nursery,"Portion of Shop 7, G/F, Commercial Accommodation, Alto Residences, 29 Tong Yin Street, Tseung Kwan O, New Territories",28134887,NIL,NON-AIDED CHILD CARE CENTRE ATTACHED TO KINDERGARTEN,2-3,0,0,6900,0,0,AM & PM Sessions,,0,0,9,WTS/SK
Malvern College Pre-School Limited,Malvern College Nursery Hong Kong,"G09-G12, G/F, Coronation Circle, 1 Yau Cheung Road, Southwest Kowloon, Kowloon",38984660,26688823,NON-AIDED CHILD CARE CENTRE ATTACHED TO KINDERGARTEN,2-3,0,0,10403,0,0,AM & PM Sessions,,0,0,40,KC/YTM
Malvern College Pre-School Limited,Malvern College Nursery Hong Kong (Island West),"Portion of Shop C on G/F and 1/F, Viking Court, 165-166 Connaught Road West, Hong Kong",38984670,26385493,NON-AIDED CHILD CARE CENTRE ATTACHED TO KINDERGARTEN,2-3,0,0,10491,0,0,AM & PM Sessions,,0,0,45,CW/S/I
Kingsful Development Limited,Manhabit International Nursery,"No. 43, Cumberland Road, Kowloon Tong, Kowloon - NKIL 741",23369638,23369632,NON-AIDED CHILD CARE CENTRE ATTACHED TO KINDERGARTEN,2-3,0,0,6288,0,0,AM & PM Sessions,,0,0,56,KC/YTM
MASS Group Limited,MASS International Preschool (Tai Hang),"Portion of Shop 2, G/F & LG/F, Block 8, Lai Tak Plaza, 2 Lai Tak Tsuen Road, Tai Hang, Hong Kong",39551588,39569013,NON-AIDED CHILD CARE CENTRE ATTACHED TO KINDERGARTEN,2-3,0,0,6550,0,0,AM & PM Sessions,,0,0,56,E/W
May Nga Education Institute Limited,May Nga Child Care Centre,"Portion of First Floor, No. 146-150 Pau Chung Street, To Kwa Wan, Kowloon",27112631,27134258,NON-AIDED CHILD CARE CENTRE ATTACHED TO KINDERGARTEN,0-3,6519,6519,0,3700,0,AM Session,,32,23,10,KC/YTM
MAY NGA EDUCATION INSTITUTE LIMITED,May Nga Nursery,"G/F, 146 & 146A Pau Chung Street, To Kwa Wan, Kowloon",27147763,27134258,NON-AIDED CHILD CARE CENTRE ATTACHED TO KINDERGARTEN,2-3,0,6501,4000,0,0,AM & PM Sessions,,0,51,1,KC/YTM
MAY NGA EDUCATION INSTITUTE LIMITED,May Nga Nursery Branch,"G/F(Portion) & 1/F(Portion), 89 Ha Heung Road, To Kwa Wan, Kowloon.",27647319,23305307,NON-AIDED CHILD CARE CENTRE ATTACHED TO KINDERGARTEN,2-3,0,0,0,0,4000,PM Session,,0,0,19,KC/YTM
Melody Education Company Limited,Melody Nursery,"G/F, Shop 181,  Melody Garden, 2 Wu Chui Road, Tuen Mun, New Territories.",24045520,24301197,NON-AIDED CHILD CARE CENTRE ATTACHED TO KINDERGARTEN,2-6,0,5410,3778,0,0,AM & PM Sessions,,0,20,55,TM
Melody Education Company Limited,Melody Nursery (Prime View),"Part of G/F, Block 1, Prime View Garden, T.M.T.L. 245, Tuen Mun, New Territories.",24574433,24301025,NON-AIDED CHILD CARE CENTRE ATTACHED TO KINDERGARTEN,2-3,0,0,0,0,3804,PM Session,,0,0,19,TM
MILLS INTERNATIONAL LIMITED,Mills International Pre-Nursery,"Portion of Shops G5 & G5A UG/F & 1/F, The Spectacle, 8 Cho Yuen Street, Yau Tong, Kowloon",27176336,27176236,NON-AIDED CHILD CARE CENTRE ATTACHED TO KINDERGARTEN,2-3,0,0,7000,0,0,AM & PM Sessions,,0,0,50,KT
Mighty Oaks International Nursery & Kindergarten Limited,Mighty Oaks International Nursery,"Portion of 1st Floor, Lungga Mansion, 46A Belcher’s Street, Kennedy Town, Hong Kong",28068383,28068500,NON-AIDED CHILD CARE CENTRE ATTACHED TO KINDERGARTEN,2-3,0,0,6800,0,0,AM & PM Sessions,,0,0,65,CW/S/I
"NG, Shui Kee",Ming Wai International Preschool,"Flat A & B, G/F & 1/F, Alice Court 10-12, Tsat Tsz Mui Road, North Point, Hong Kong",25615008,25900309,NON-AIDED CHILD CARE CENTRE ATTACHED TO KINDERGARTEN,2-3,0,10180,6210,0,0,AM & PM Sessions,,0,14,98,E/W
"NG, Shui Kee",Ming Wai International Preschool (North Point Branch),"Portion of Shop 1, G/F & 1/F, Fairview Court, 5-13 Tsat Tsz Mui Road, North Point, Hong Kong",29040638,25900309,NON-AIDED CHILD CARE CENTRE ATTACHED TO KINDERGARTEN,2-3,0,0,6210,0,0,AM & PM Sessions,,0,0,24,E/W
Ming Wai Education Organization Limited,Ming Wai International Preschool (Prince Edward Branch),"Portion of Shop 3-9 on G/F & Flat 1-5 on 1/F, Kenwood Mansion, 15 Playing Field Road, Kowloon",25222688,27711822,NON-AIDED CHILD CARE CENTRE ATTACHED TO KINDERGARTEN,2-3,0,11110,6420,0,0,AM & PM Sessions,,0,13,208,KC/YTM
"(i) LO Mo-man and (ii) YEUNG Lai-mei, Kathy",Mink International Play School,"Level 1, Sun Hing Garden, Tai Po, New Territories.",26654333,26639555,NON-AIDED CHILD CARE CENTRE ATTACHED TO KINDERGARTEN,2-3,0,7914,5540,0,0,AM & PM Sessions,,0,36,90,TP/N
Chiara Anoma De Silva,Montessori for Children (Nursery),"House A, Phoenix Garden, R.B.L. 1033, Tai Tam Village, Stanley, Hong Kong",28139589,28132582,NON-AIDED CHILD CARE CENTRE ATTACHED TO KINDERGARTEN,2-3,0,0,9700,0,0,AM & PM Sessions,,0,0,43,CW/S/I
Mulberry House International Education Limited,MULBERRY HOUSE INTERNATIONAL CHILD CARE CENTRE,"Kindergarten Premises, Portion of G/F & LG/F, Commercial Accommodation, Mayfair By the Sea 1, 23 Fo Chun Road, Tai Po, New Territories",23119008,23119350,NON-AIDED CHILD CARE CENTRE ATTACHED TO KINDERGARTEN,2-3,0,0,0,9020,7900,AM & PM Sessions,,0,0,28,TP/N
Philosophia Education Limited,Mynors International Nursery,"Portion A of Commercial Unit Nos. 1-11 on Level 1 of Belair Monte, 3 Ma Sik Road, Fanling, New Territories",23557500,23557600,NON-AIDED CHILD CARE CENTRE ATTACHED TO KINDERGARTEN,2-3,0,7700,3900,0,0,AM & PM Sessions,,0,1,125,TP/N
New Territories Women & Juveniles Welfare Association Limited,Pentecostal Church of Hong Kong Leung Sing Tak Nursery School,"Part of 4/F Podium, Wings A & B & C, Sheung Ming House, Sheung Tak Estate, Tseung Kwan O, New Territories",21770272,21770788,NON-AIDED CHILD CARE CENTRE ATTACHED TO KINDERGARTEN,2-3,0,4671,2860,0,0,AM & PM Sessions,,0,15,15,WTS/SK
HUI Wing-to,New Generation Nursery,"Level 3, Sun Tuen Mun Shopping Centre, 55-56 Lung Mun Road, Tuen Mun, N.T.",24625728,24639708,NON-AIDED CHILD CARE CENTRE ATTACHED TO KINDERGARTEN,2-6,0,6286,3816,0,0,AM & PM Sessions,,0,30,68,TM
ELEMENTI EDUCATION ORGANIZATION NON-PROFIT MAKING LIMITED,New Jade Elementi International Nursery,"L4 (Portion), Government Building Block, New Jade Shopping Arcade, Kut Shing Street, Chai Wan, Hong Kong",28979157,25059110,NON-AIDED CHILD CARE CENTRE ATTACHED TO KINDERGARTEN,2-3,0,6134,4368,0,0,AM & PM Sessions,,0,36,26,E/W
"The Methodist Church, Hong Kong",North Point Methodist Church Day Nursery (Fortress Hill),"No. 1-11 on 1/F Princess Mansion, No. 165A-175 King's Road, Hong Kong",25787913,25719988,NON-AIDED CHILD CARE CENTRE ATTACHED TO KINDERGARTEN,2-3,0,0,5000,0,0,AM & PM Sessions,,0,0,116,E/W
Hopedale Limited,Olive Tree International Nursery,"Portion of Shop D, G/F, Cronin Garden, 20 Shun Ning Road, Sham Shui Po, Kowloon",26188050,NIL,NON-AIDED CHILD CARE CENTRE ATTACHED TO KINDERGARTEN,2-3,0,0,5800,0,0,AM & PM Sessions,,0,0,56,SSP
"LAU, E-Ling Ella",Parkview International Nursery,"G/F, Tower 18, Parkview, 88 Tai Tam Reservoir Road, Hong Kong",28126023,28122938,NON-AIDED CHILD CARE CENTRE ATTACHED TO KINDERGARTEN,0-3,0,0,10200,0,0,AM & PM Sessions,,0,0,50,CW/S/I
Park View International Kindergarten Limited,Parkview International Pre-school (Kowloon),"Portion of Podium Level, Kowloon Station, 1 Austin Road West, Kowloon",28126801,28126201,NON-AIDED CHILD CARE CENTRE ATTACHED TO KINDERGARTEN,0-3,0,0,8650,0,0,AM & PM Sessions,,0,0,116,KC/YTM
English Connection Learning Centre Limited,SDM - Chatsworth International Nursery,"G/F (Excluding Classroom 9), 1/F & 2/F, No. 166-166A Boundary Street, Kowloon",25603322,25603332,NON-AIDED CHILD CARE CENTRE ATTACHED TO KINDERGARTEN,2-3,0,0,5636,0,0,AM & PM Sessions,,0,0,42,KC/YTM
"Ms CHU ka-nam, Yvonne",Pods Preschool (Tin Hau),"1st Floor of Magnolia Mansion, No. 4 Tin Hau Temple Road, Hong Kong",34603560,34603559,NON-AIDED CHILD CARE CENTRE ATTACHED TO KINDERGARTEN,2-3,0,0,7854,0,0,AM & PM Sessions,,0,0,45,E/W
Po Leung Kuk,Po Leung Kuk Lee Shu Fook Nursery,"Portion of Shop 2, G/F, On Chung House, and Shop 2, G/F and 1/F, Commercial Block 1, Shun On Estate, Kwun Tong, Kowloon",23866983,23864718,NON-AIDED CHILD CARE CENTRE ATTACHED TO KINDERGARTEN,2-3,0,0,4360,0,0,AM & PM Sessions,,0,0,47,KT
Po Leung Kuk,Po Leung Kuk Vicwood Chong Kee Ting Nursery,"Portion of Vocational Training Centre, G/F, 66 Leighton Road, Hong Kong",28949921,25043466,NON-AIDED CHILD CARE CENTRE ATTACHED TO KINDERGARTEN,2-3,0,0,4585,0,0,AM & PM Sessions,,0,0,22,E/W
Sisters of the Precious Blood,Precious Blood Nursery,"123 Un Chau Street, Sham Shui Po, Kowloon",23862586,23869691,NON-AIDED CHILD CARE CENTRE ATTACHED TO KINDERGARTEN,2-3,0,5099,3310,0,0,AM & PM Sessions,,0,185,48,SSP
